Statement,Type of Fallacy
"It's raining, so I should wear a winter coat.",Non Sequitur
"He's a good singer, so I'll start painting.",Non Sequitur
"I like watching movies, so I'll start a new fitness routine.",Non Sequitur
"The dog is howling, so it must be afraid of something.",Non Sequitur
"I finished a book, so I'll buy a new car.",Non Sequitur
"It's raining, so the plants must be happy.",Non Sequitur
"He enjoys swimming, so I'll clean out the garage.",Non Sequitur
"It's sunny today, therefore it will be sunny tomorrow.",Non Sequitur
"She dyed her hair pink, so I'll start gardening.",Non Sequitur
"The car is loud, so it must be fast.",Non Sequitur
"It's windy, so I should bring a kite.",Non Sequitur
"It's raining, thus I must have left the windows open.",Non Sequitur
"I enjoy photography, so I should clean out the garage.",Non Sequitur
"The book is old, thus it must be valuable.",Non Sequitur
"It's Monday, so I should wear my pajamas to work.",Non Sequitur
"Lisa is wearing headphones, so she must be listening to music.",Non Sequitur
"She owns a cat, so she must be a loner.",Non Sequitur
"The sun is shining brightly, hence I should bring an umbrella.",Non Sequitur
"He's a good dancer, therefore, I'll start a new diet.",Non Sequitur
"I like to travel, so I'll rearrange the furniture.",Non Sequitur
"I prefer tea over coffee, therefore, I'll learn French.",Non Sequitur
"He's wearing glasses, so he must be smart.",Non Sequitur
"I bought new shoes, therefore, I'll adopt a puppy.",Non Sequitur
"He's wearing a hoodie, so he must be a troublemaker.",Non Sequitur
"She's wearing a coat, so it must be winter.",Non Sequitur
"He enjoys swimming, so I'll start gardening.",Non Sequitur
"The dog is small, so it must be harmless.",Non Sequitur
"Tina is wearing a watch, so she must be punctual.",Non Sequitur
"It's sunny, thus I should wear sunglasses.",Non Sequitur
"Sarah is always exercising, so she must be fit.",Non Sequitur
"She's wearing a ring, so she must be engaged.",Non Sequitur
"David is wearing gloves, so he must be a doctor.",Non Sequitur
"Sarah has a lot of pets, so she must love animals.",Non Sequitur
"She's wearing sunglasses, so she must be trendy.",Non Sequitur
"Maria is wearing a bracelet, so she must be wealthy.",Non Sequitur
"The book is thick, so it must be long.",Non Sequitur
"I finished a puzzle, therefore, I should buy new shoes.",Non Sequitur
"I like watching movies, so I'll adopt a puppy.",Non Sequitur
"I enjoy photography, therefore, I'll buy a new hat.",Non Sequitur
"She's always smiling, so she must be happy.",Non Sequitur
"The car is covered in mud, so it must have been off-road.",Non Sequitur
"He's wearing a wedding ring, so he must be married.",Non Sequitur
"Sam is always late, so he must have a bad sense of time.",Non Sequitur
"Tom is a chef, so he must be a great cook.",Non Sequitur
"I like playing guitar, so I'll clean out the garage.",Non Sequitur
"The sun is shining, so it must be hot outside.",Non Sequitur
"It's snowing, so I should wear a tank top.",Non Sequitur
"Sarah has a lot of plants, so she must love gardening.",Non Sequitur
"He's wearing a tie, so he must be important.",Non Sequitur
"Julia is blonde, therefore she must be unintelligent.",Non Sequitur
"Michael drives a red car, so he must be a reckless driver.",Non Sequitur
"Tom likes to hike, so he must be an environmentalist.",Non Sequitur
"Lisa is wearing gloves, so she must be cold.",Non Sequitur
"He's a good singer, so I'll buy a new hat.",Non Sequitur
"It's snowing, thus global warming must be a hoax.",Non Sequitur
"It's snowing in April, so climate change must be a hoax.",Non Sequitur
"The cat is rubbing against my leg, so it must be affectionate.",Non Sequitur
"I finished a puzzle, therefore, I'll learn to surf.",Non Sequitur
"It's snowing, so I should wear a swimsuit.",Non Sequitur
"I bought new shoes, therefore, I'll take up knitting.",Non Sequitur
"I like to travel, so I'll start painting.",Non Sequitur
"She's wearing a hat, so she must be fashionable.",Non Sequitur
"She dyed her hair pink, so let's go for a hike.",Non Sequitur
"It's raining, so I must have forgotten my umbrella.",Non Sequitur
"I got a parking ticket today, therefore the city must be targeting me unfairly.",Non Sequitur
"The restaurant is closed, so the food must be bad.",Non Sequitur
"Bob wears a hat, thus he must be bald.",Non Sequitur
"I have a headache, therefore it must be raining.",Non Sequitur
"It's windy today, so I'll clean the garage.",Non Sequitur
"She owns a lot of makeup, thus she must be very vain.",Non Sequitur
"I enjoy writing, therefore, I'll clean the garage.",Non Sequitur
"I like to watch movies, therefore, I'll buy new curtains.",Non Sequitur
"I prefer coffee over tea, so I'll take up knitting.",Non Sequitur
"The cat is purring, so it must be content.",Non Sequitur
"The sun is shining, so it must be daytime.",Non Sequitur
"She's wearing a red shirt, so she must be passionate.",Non Sequitur
"Karen wears a lot of jewelry, so she must be wealthy.",Non Sequitur
"I enjoy writing, therefore, I'll buy new shoes.",Non Sequitur
"The movie is a comedy, so it must be funny.",Non Sequitur
"He's wearing a suit, so he must be formal.",Non Sequitur
"Sarah eats salad for lunch, so she must be a vegetarian.",Non Sequitur
"The road is wet, so it must have rained.",Non Sequitur
"It's windy, so I should wear a hat.",Non Sequitur
"He's wearing a tie, so he must be formal.",Non Sequitur
"The sun is shining, thus it must be a beautiful day.",Non Sequitur
"The cat is sitting on the windowsill, so it must be curious.",Non Sequitur
"He's a doctor, thus he must know everything about every medical condition.",Non Sequitur
"The dog is barking, so it must be time to eat.",Non Sequitur
"The restaurant is quiet, so the food must be bland.",Non Sequitur
"Bob is a firefighter, thus he must be fearless.",Non Sequitur
"The movie is in black and white, so it must be old.",Non Sequitur
"The dog is wagging its tail, so it must be happy.",Non Sequitur
"If you study hard, you'll get into a good college, so you don't need extracurricular activities.",Non Sequitur
"The cat is purring, so it must be happy.",Non Sequitur
"The dog is sleeping, so it must be tired.",Non Sequitur
"I finished a puzzle, therefore, I'll buy a new laptop.",Non Sequitur
"I finished a puzzle, therefore, I'll adopt a puppy.",Non Sequitur
"I enjoy hiking, therefore, I'll clean the garage.",Non Sequitur
"Mike is wearing sunglasses, so he must be stylish.",Non Sequitur
"David is wearing sunglasses, so he must be stylish.",Non Sequitur
"Jenny wears makeup, so she must be insecure.",Non Sequitur
"The phone rang, thus the doorbell must be broken.",Non Sequitur
"I passed my driving test, so I'll buy a new hat.",Non Sequitur
"He's wearing a suit, so he must be important.",Non Sequitur
"I passed my math test, so I'll probably go to the beach this weekend.",Non Sequitur
"I bought new shoes, so global warming is a hoax.",Non Sequitur
"It's hot outside, thus I should wear shorts.",Non Sequitur
"He's a musician, so he must be good at math.",Non Sequitur
"The store is closed, thus they must not have any customers.",Non Sequitur
"Tom is wearing sunglasses, so he must be cool.",Non Sequitur
"I prefer coffee over tea, so I'll learn to cook.",Non Sequitur
"Playing video games makes you violent, so all gamers must be violent people.",Non Sequitur
"Lisa is wearing a scarf, so she must be fashionable.",Non Sequitur
"The traffic lights are red, so I should plant a garden.",Non Sequitur
"The car is expensive, thus it must be reliable.",Non Sequitur
"It's hot outside, so I should wear a winter coat.",Non Sequitur
"The cat is scratching the furniture, so it must be angry.",Non Sequitur
"I won a prize, therefore, I'll start gardening.",Non Sequitur
"I got a promotion, so I'll rearrange the furniture.",Non Sequitur
,Non Sequitur
"I enjoy photography, therefore, I'll learn French.",Non Sequitur
"She dyed her hair pink, therefore, I'll buy a new hat.",Non Sequitur
"The politician is smiling, so he must be trustworthy.",Non Sequitur
"The movie is in black and white, so it must be classic.",Non Sequitur
"I won a prize, so I'll rearrange the furniture.",Non Sequitur
"The restaurant is busy, so the food must be good.",Non Sequitur
"I passed my driving test, so I'll learn to surf.",Non Sequitur
"She's wearing sunglasses, so she must be a celebrity.",Non Sequitur
"I enjoy hiking, therefore, I'll take up knitting.",Non Sequitur
"The cat is purring, so it must be comfortable.",Non Sequitur
"Eating carrots improves eyesight, thus carrots must cure cancer.",Non Sequitur
"Jane is a doctor, therefore she must drive a fancy car.",Non Sequitur
"I prefer coffee over tea, so I'll adopt a puppy.",Non Sequitur
"He's wearing a hoodie, so he must be a skateboarder.",Non Sequitur
"The book is thick, so it must be boring.",Non Sequitur
"She's wearing high heels, so she must be going to a fancy event.",Non Sequitur
"The cat meows a lot, so it must be hungry.",Non Sequitur
"The restaurant is crowded, so the food must be popular.",Non Sequitur
"I like watching movies, so I'll clean the garage.",Non Sequitur
"People who wear glasses are smart, so everyone with glasses must be smart.",Non Sequitur
"The clock is ticking, therefore time must exist.",Non Sequitur
"Sarah is always drawing, so she must be artistic.",Non Sequitur
"I like watching movies, so I'll rearrange the furniture.",Non Sequitur
"Sarah is always smiling, so she must be a cheerful person.",Non Sequitur
"It's snowing, so I should turn on the air conditioning.",Non Sequitur
"The company made a profit this quarter, thus the CEO must be doing a great job.",Non Sequitur
"Tom doesn't like chocolate, so he must not like sweets at all.",Non Sequitur
"The store is crowded, so it must be having a sale.",Non Sequitur
"I like to travel, so I'll take up knitting.",Non Sequitur
"I like swimming, therefore, I should buy a new laptop.",Non Sequitur
"It's raining outside, so I'll adopt a puppy.",Non Sequitur
"She's wearing a red scarf, therefore, I'll go for a swim.",Non Sequitur
"Mike is from England, thus he must drink tea all the time.",Non Sequitur
"I bought new shoes, therefore, I'll learn French.",Non Sequitur
"She's wearing a hat, so she must be bald.",Non Sequitur
"I like playing guitar, so I'll buy a new laptop.",Non Sequitur
"The restaurant is expensive, so the service must be exceptional.",Non Sequitur
"I like to travel, so I'll learn French.",Non Sequitur
"The cat is grooming itself, so it must be clean.",Non Sequitur
"It's windy today, so I'll buy a new car.",Non Sequitur
"Sarah has a lot of friends, so she must be popular.",Non Sequitur
"David wears a backpack, so he must be a backpacker.",Non Sequitur
"I like watching movies, so I'll buy a new hat.",Non Sequitur
"The store is closed, so it must be out of business.",Non Sequitur
"I finished a puzzle, therefore, I'll buy new curtains.",Non Sequitur
"The dog is lying in the sun, so it must be warm.",Non Sequitur
"She's wearing sunglasses, so she must be stylish.",Non Sequitur
"He enjoys swimming, so I'll buy a new hat.",Non Sequitur
"The restaurant is empty, so the food must be terrible.",Non Sequitur
"The grass is green, therefore, my car needs an oil change.",Non Sequitur
"I enjoy hiking, therefore, I'll start painting.",Non Sequitur